tvo,num_voters,num_stations,description
ОВО №85,145931,166,"Центр: місто КалушОВО включає: місто Калуш, Калуський, Рогатинський райони, частина Галицького району (виборчі дільниці № 260106 – 260109, 260130, 260133, 260140, 260154)"
ОВО №86,148235,139,"Центр: місто ДолинаОВО включає: місто Болехів з населеними пунктами Болехівської міської ради, Долинський, Рожнятівський райони, частина Богородчанського району (виборчі дільниці № 260008, 260009, 260014, 260015, 260020 – 260023, 260027, 260034 – 260039, 260045, 260046)"
ОВО №87,147555,118,"Центр: місто НадвірнаОВО включає: місто Яремче з населеними пунктами Яремчанської міської ради, Надвірнянський район, частина Богородчанського (виборчі дільниці № 260001 – 260007, 260010 – 260013, 260016 – 260019, 260024 – 260026, 260028 – 260033, 260040 – 260044, 260047), частина Коломийського (виборчі дільниці № 260329 – 260338, 260408) районів"
ОВО №88,162359,165,"Центр: місто КоломияОВО включає: місто Коломия, Городенківський район, частина Коломийського району (виборчі дільниці № 260339 – 260407, 260409 – 260411)"
ОВО №89,143944,159,"Центр: місто СнятинОВО включає: Верховинський, Косівський, Снятинський райони"
ОВО №90,162732,97,Центр: місто Біла ЦеркваОВО включає: місто Біла Церква
ОВО №91,150287,167,"Центр: селище міського типу МакарівОВО включає: місто Фастів, Макарівський, Фастівський райони, частина Києво-Святошинського (виборчі дільниці № 320562, 320578 – 320582, 320597, 320598, 320607 – 320609, 320612 – 320614, 320617, 320618, 320624, 320628 – 320640, 320642), частина Сквирського (виборчі дільниці № 320872 –320874, 320878, 320879, 320883 – 320885, 320887 – 320889, 320893, 320894, 320896 – 320900, 320902, 320903) районів"
ОВО №92,155612,216,"Центр: місто УзинОВО включає: Білоцерківський, Володарський, Ставищенський, Таращанський, Тетіївський райони, частина Сквирського району (виборчі дільниці № 320862 – 320871, 320875 – 320877, 320880 – 320882, 320886, 320890 – 320892, 320895, 320901, 320904 – 320909)"
ОВО №93,146125,181,"Центр: місто МиронівкаОВО включає: міста Переяслав-Хмельницький, Ржищів, Богуславський, Кагарлицький, Миронівський, Рокитнянський райони"
ОВО №94,&nbsp,136,"Центр: місто ОбухівОВО включає: міста Васильків, Обухів, Васильківський, Обухівський райони"
ОВО №95,158523,89,"Центр: місто ІрпіньОВО включає: місто Ірпінь, частина Києво-Святошинського району (виборчі дільниці № 320559 – 320561, 320563 – 320577, 320583 – 320596, 320599 –320606, 320610, 320611, 320615, 320616, 320619 – 320623, 320625 – 320627, 320641, 320643, 320644)"
ОВО №96,179866,194,"Центр: місто ВишгородОВО включає: міста Буча, Славутич, Бородянський, Вишгородський, Іванківський, Поліський райони"
ОВО №97,177361,136,"Центр: місто БровариОВО включає: міста Березань, Бровари, Баришівський район, частина Броварського району (виборчі дільниці № 320226 – 320250, 320253 – 320268,  320269 – 320272, 320276, 320277)"
ОВО №98,179211,185,"Центр: місто ЯготинОВО включає: місто Бориспіль, Бориспільський, Згурівський, Переяслав-Хмельницький, Яготинський райони, частина Броварського району (виборчі дільниці № 320251, 320252, 320273 – 320275)"
ОВО №99,176093,111,"Центр: місто Кіровоград, Ленінський районОВО включає: частина Кіровського (виборчі дільниці № 350814 – 350869, 350874, 350875, 350882 – 350890), частина Ленінського (виборчі дільниці № 350894 – 350936) районів міста Кіровограда"
ОВО №100,155902,235,"Центр: Бобринецький районОВО включає: частина Кіровського (виборчі дільниці № 350876 – 350881), частина Ленінського (виборчі дільниці № 350892, 350893) районів міста Кіровограда, Бобринецький, Вільшанський, Добровеличківський, Кіровоградський, Компаніївський, Новоукраїнський райони, селище міського типу Нове Кіровоградської міської ради (виборчі дільниці № 350870 – 350873, 350891)"
ОВО №101,151723,204,"Центр: селище міського типу ГолованівськОВО включає: Гайворонський, Голованівський, Маловисківський, Новоархангельський, Новомиргородський, Ульяновський райони"
ОВО №102,152881,195,"Центр: місто Знам’янкаОВО включає: міста Знам’янка, Світловодськ,  Знам’янський, Новгородківський, Олександрівський, Онуфріївський, Світловодський райони"
ОВО №103,155212,192,"Центр: місто  ОлександріяОВО включає: місто Олександрія, Долинський, Олександрійський, Петрівський, Устинівський райони"
ОВО №104,178334,109,"Центр: місто Луганськ, Артемівський районОВО включає: Артемівський район, частина Кам’янобрідського району міста Луганська (виборчі дільниці № 441414 – 441418, 441433), частина Лутугинського району (виборчі дільниці № 440170 – 440178, 440186 – 440198, 440201 – 440203, 440206 – 440215)"
ОВО №105,172763,98,"Центр: місто Луганськ, Жовтневий районОВО включає: Жовтневий район, частина Кам’янобрідського району міста Луганська (виборчі дільниці № 441419 – 441432)"
ОВО №106,158555,109,"Центр: місто СєвєродонецькОВО включає: місто Сєвєродонецьк, частина міста Стаханова (виборчі дільниці № 441212 – 441232, 441249 – 441251, 441258 – 441262), частина Попаснянського району (виборчі дільниці № 440393 – 440421, 440424)"
ОВО №107,168551,92,"Центр: місто ЛисичанськОВО включає: місто Лисичанськ, частина міста Стаханова (виборчі дільниці № 441233 – 441248, 441252 – 441257), частина міста Первомайська (виборчі дільниці № 440975 – 440980, 440987, 440988), частина Попаснянського району  (виборчі дільниці № 440381 – 440392, 440422, 440423)"
ОВО №108,161450,142,"Центр: місто Красний ЛучОВО включає: місто Красний Луч, Перевальський район"
ОВО №109,169977,154,"Центр: місто КраснодонОВО включає: місто Краснодон, Ленінський район міста Луганська, Краснодонський район"
ОВО №110,177508,134,"Центр: місто АлчевськОВО включає: міста Алчевськ, Антрацит, частина Антрацитівського (виборчі дільниці № 440009 – 440013, 440015 – 440020, 440028), частина Лутугинського (виборчі дільниці № 440179 – 440185, 440199, 440200, 440204, 440205) районів"
ОВО №111,171785,146,"Центр: місто СвердловськОВО включає: міста Свердловськ, Ровеньки, частина Антрацитівського району (виборчі дільниці № 440001 – 440008, 440014, 440021 – 440027, 440029 –440034)"
ОВО №112,158931,107,"Центр: місто РубіжнеОВО включає: міста Рубіжне, Кіровськ, Брянка, частина міста Первомайська (виборчі дільниці № 440981 – 440986, 440989 – 441015)"
ОВО №113,159090,203,"Центр: місто СватовеОВО включає: Білокуракинський, Кремінський, Новоайдарський, Сватівський, Старобільський, Троїцький райони"
ОВО №114,154032,198,"Центр: селище міського типу Станиця ЛуганськаОВО включає: Біловодський, Марківський, Міловський, Новопсковський, Слов’яносербський, Станично-Луганський райони"
ОВО №115,170995,95,"Центр: місто Львів, Сихівський районОВО включає: Сихівський район, частина Личаківського району міста Львова (виборчі дільниці № 461925 – 461928, 461931, 461935, 461936, 461940 – 461942, 461947 – 461950, 461954 – 461959, 461962 – 461975)"
ОВО №116,178391,79,"Центр: місто Львів, Залізничний районОВО включає: Залізничний район, частина Шевченківського району міста Львова (виборчі дільниці № 462109 – 462113, 462119 – 462129, 462137 –462150)"
ОВО №117,175125,95,"Центр: місто Львів, Франківський районОВО включає: Галицький, Франківський райони, частина Шевченківського району міста Львова (виборчі дільниці № 462130 – 462136)"
ОВО №118,171624,137,"Центр: місто Львів, Личаківський районОВО включає: частина Личаківського (виборчі дільниці № 461929, 461930, 461932 – 461934, 461937 – 461939, 461943 – 461946, 461951 – 461953, 461960, 461961), частина Шевченківського (виборчі дільниці № 462095 – 462108, 462114 – 462118, 462151, 462152) районів міста Львова, Пустомитівський район"
ОВО №119,154303,248,"Центр: місто БродиОВО включає: Бродівський, Буський, Радехівський райони, частина Кам’янка-Бузького району (виборчі дільниці № 460614 – 460618, 460622, 460623, 460625 – 460643, 460649 – 460653, 460658, 460663, 460664, 460670 – 460679)"
ОВО №120,154134,247,"Центр: місто ГородокОВО включає: Городоцький, Мостиський райони, частина Самбірського  району (виборчі дільниці № 461059 – 461136, 461140 – 461147)"
ОВО №121,176804,143,"Центр: місто ДрогобичОВО включає: міста Борислав, Дрогобич, Трускавець, Дрогобицький район"
ОВО №122,175091,207,"Центр: місто ЯворівОВО включає: Жовківський, Яворівський райони"
ОВО №123,160071,253,"Центр: місто ПеремишляниОВО включає: місто Новий Розділ, Золочівський, Миколаївський, Перемишлянський райони"
ОВО №124,150504,164,"Центр: місто СокальОВО включає: місто Червоноград, Сокальський район, частина Кам’янка-Бузького району (виборчі дільниці № 460619 – 460621, 460624, 460644 –460648, 460654 – 460657, 460659 – 460662, 460665 – 460669)"
ОВО №125,164027,265,"Центр: місто Старий СамбірОВО включає: місто Самбір, Сколівський, Старосамбірський, Турківський райони, частина Самбірського району (виборчі дільниці №  461137 – 461139)"
ОВО №126,153655,223,"Центр: місто СтрийОВО включає: міста Моршин, Стрий, Жидачівський, Стрийський райони"
ОВО №127,155062,126,"Центр: місто Миколаїв, Заводський районОВО включає: місто Очаків, Заводський район міста Миколаєва, Миколаївський, Очаківський райони"
ОВО №128,172604,92,"Центр: місто Миколаїв, Ленінський районОВО включає: Ленінський, Корабельний райони міста Миколаєва"
ОВО №129,152428,106,"Центр: місто Миколаїв, Центральний районОВО включає: Центральний район міста Миколаєва, Жовтневий район"
ОВО №130,147543,236,"Центр: місто БаштанкаОВО включає: Баштанський, Березнегуватський, Казанківський, Новобузький, Новоодеський, Снігурівський райони"
ОВО №131,161553,191,"Центр: місто ВознесенськОВО включає: міста Вознесенськ, Южноукраїнськ, Березанський, Веселинівський, Вознесенський, Доманівський, Єланецький райони"
ОВО №132,&nbsp,186,"Центр: місто ПервомайськОВО включає: місто Первомайськ, Арбузинський, Братський, Врадіївський, Кривоозерський, Первомайський райони"
ОВО №133,178761,86,"Центр: місто Одеса, Київський районОВО включає: Київський район міста Одеси"
ОВО №134,177426,85,"Центр: місто Одеса, Малиновський районОВО включає: частина Малиновського району міста Одеси (виборчі дільниці № 511159 –511218, 511220, 511222 – 511244)"
ОВО №135,180297,95,"Центр: місто Одеса, Приморський районОВО включає: Приморський район міста Одеси"
ОВО №136,180127,89,"Центр: місто Одеса, Суворовський районОВО включає: частина Малиновського (виборчі дільниці № 511219, 511221), частина Суворовського (виборчі дільниці № 511340 – 511365, 511374 –511434) районів міста Одеси"
ОВО №137,144471,204,"Центр: місто КотовськОВО включає: місто Котовськ, Балтський, Кодимський, Котовський, Красноокнянський, Савранський райони"
ОВО №138,153182,242,"Центр: селище міського типу ШиряєвеОВО включає: Ананьївський, Березівський, Іванівський, Любашівський, Миколаївський, Ширяївський райони, частина Комінтернівського району (виборчі дільниці № 510473 – 510498, 510521, 510522)"
ОВО №139,174259,140,"Центр: місто РоздільнаОВО включає: місто Южне, частина Суворовського району міста Одеси (виборчі дільниці № 511366 – 511373), Великомихайлівський, Роздільнянський, Фрунзівський райони, частина Біляївського (виборчі дільниці № 510222, 510223, 510230, 510237, 510238, 510241 – 510243, 510246, 510248, 510249, 510252, 510257, 510263 – 510265, 510268, 510269, 510276, 510277), частина Комінтернівського (виборчі дільниці № 510499 – 510520, 510523) районів"
ОВО №140,178320,110,"Центр: місто БіляївкаОВО включає: міста Іллічівськ, Теплодар, Овідіопольський район, частина Біляївського району (виборчі дільниці № 510224 – 510229, 510231 – 510236, 510239, 510240, 510244, 510245, 510247, 510250, 510251, 510253 – 510256, 510258 – 510262, 510266, 510267, 510270 – 510275, 510278 – 510282)"
ОВО №141,157413,145,"Центр: місто ТатарбунариОВО включає: місто Білгород-Дністровський, Білгород-Дністровський, Татарбунарський райони, частина Кілійського району (виборчі дільниці № 510407 – 510423, 510425 – 510428, 510431, 510435, 510439, 510440)"
ОВО №142,161432,155,"Центр: місто АрцизОВО включає: Арцизький, Саратський, Тарутинський райони, частина Болградського (виборчі дільниці № 510283 – 510290, 510296, 510298 –510315, 510317, 510318), частина Кілійського (виборчі дільниці № 510424, 510429, 510430, 510432 – 510434, 510436 – 510438) районів"
ОВО №143,147232,116,"Центр: місто ІзмаїлОВО включає: місто Ізмаїл, Ізмаїльський, Ренійський райони, частина Болградського району (виборчі дільниці № 510291 – 510295, 510297, 510316)"
ОВО №144,152971,85,"Центр: місто Полтава, Октябрський районОВО включає: Ленінський, Октябрський райони міста Полтави"
ОВО №145,158582,132,"Центр: місто Полтава, Київський районОВО включає: Київський район міста Полтави, Котелевський, Полтавський райони"
ОВО №146,149013,85,"Центр: місто КременчукОВО включає: частина Автозаводського району (виборчі дільниці № 531040 –531085, 531099, 531100), Крюківський район міста Кременчука"
ОВО №147,145692,190,"Центр: місто МиргородОВО включає: місто Миргород, Диканський, Зіньківський, Миргородський, Решетилівський, Шишацький райони"
ОВО №148,154253,219,"Центр: місто ЛубниОВО включає: місто Лубни, Великобагачанський, Оржицький, Семенівський, Хорольський райони, частина Лубенського району (виборчі дільниці № 530474 – 530494, 530504 – 530506, 530522 – 530531)"
ОВО №149,150484,215,"Центр: місто КарлівкаОВО включає: Карлівський, Кобеляцький, Козельщинський, Машівський, Новосанжарський, Чутівський райони"
ОВО №150,150592,127,"Центр: місто КомсомольськОВО включає: місто Комсомольськ, частина Автозаводського району міста Кременчука (виборчі дільниці № 531086 – 531098), Глобинський, Кременчуцький райони"
ОВО №151,147704,220,"Центр: місто ЛохвицяОВО включає: Гадяцький, Гребінківський, Лохвицький, Пирятинський, Чорнухинський райони, частина Лубенського району (виборчі дільниці № 530495 – 530503, 530507 – 530521)"
ОВО №152,172603,94,"Центр: місто РівнеОВО включає: частина міста Рівного (виборчі дільниці № 560901 – 560974, 560984 – 561002)"
ОВО №153,176213,230,"Центр: місто РівнеОВО включає: місто Острог, частина міста Рівного (виборчі дільниці 
№ 560975 – 560983), Гощанський, Корецький, Острозький, Рівненський райони"
ОВО №154,180130,266,"Центр: місто ДубноОВО включає: місто Дубно, Демидівський, Дубенський, Здолбунівський, Млинівський, Радивилівський райони"
ОВО №155,173401,212,"Центр: місто ДубровицяОВО включає: місто Кузнецовськ, Володимирецький, Дубровицький, Зарічненський, Рокитнівський райони"
ОВО №156,168989,200,"Центр: місто СарниОВО включає: Березнівський, Костопільський, Сарненський райони"
ОВО №157,179266,100,"Центр: місто СумиОВО включає: Ковпаківський район, частина Зарічного району міста Сум (виборчі дільниці № 590884 – 590895, 590926 – 590943, 591015), село Піщане Сумської міської ради з населеними пунктами Піщанської сільської ради"
ОВО №158,175682,190,"Центр: місто БілопілляОВО включає: частина Зарічного району міста Сум (виборчі дільниці № 590896 – 590925, 590944 – 590946), Білопільський, Краснопільський, Сумський райони"
ОВО №159,146948,224,"Центр: місто ГлухівОВО включає: місто Глухів, Глухівський, Путивльський, Середино-Будський, Ямпільський райони, частина Кролевецького (виборчі дільниці № 590260 –590274, 590276 – 590278, 590280, 590282 – 590284, 590287, 590288, 590291, 590295 – 590299), частина Конотопського (виборчі дільниці № 590176, 590177, 590181 – 590183, 590185, 590186, 590188, 590190 – 590192, 590196 –590198, 590210, 590213), частина Шосткінського (виборчі дільниці № 590679 – 590688, 590694 – 590699) районів"
ОВО №160,147395,99,"Центр: місто ШосткаОВО включає: міста Конотоп, Шостка, частина Конотопського (виборчі дільниці № 590179, 590180, 590200, 590207, 590208), частина Кролевецького (виборчі дільниці № 590275, 590279, 590281, 590285, 590286, 590289, 590290, 590292 – 590294), частина Шосткінського (виборчі дільниці № 590675 –590678, 590689 – 590693, 590700 – 590703) районів"
ОВО №161,148782,229,"Центр: місто РомниОВО включає: місто Ромни, Буринський,  Липоводолинський, Недригайлівський, Роменський райони, частина Конотопського району (виборчі дільниці № 590172 – 590175, 590178, 590184, 590187, 590189, 590193 – 590195, 590199, 590201 – 590206, 590209, 590211, 590212, 590214 –590218)"
ОВО №162,147841,174,"Центр: місто ОхтиркаОВО включає: міста Лебедин, Охтирка, Великописарівський, Лебединський, Охтирський, Тростянецький райони"
